{
  "schema": "hacp.v0_3_candidate.external_bundle_manifest.v1",
  "candidateStatus": true,
  "qualificationIntent": "independent_production_plus_cross_validation",
  "conformancePackage": {
    "manifestSha256": "b794afa184761792d7a5c682ea8eed5a94f49d65289b429d747afc51d595d33c",
    "schemaBaseUri": "https://hacp.example/schemas/v0.3-candidate/",
    "recordSchemaSha256": {
      "common-defs.schema.json": "702ce603cf2a3f5bde62296fde230f3a80545a8bcbb61acde853dff784804621",
      "task-packet.schema.json": "9b7447bac08afcdb88ca5c275d1f897d6aff8a83f41e068bb79480f185da3dea",
      "review-finding.schema.json": "d125d9278f752e8da50ec466cf0d8c8cea4600a84b304640307a236c9ff71918",
      "human-decision.schema.json": "ff7dd8031589a91857a10b6b84d82ca6091b9040c17aab52c4002ebe103b5af0",
      "consumption-receipt.schema.json": "f03c6a4169146def1e0194bb657f8c59bcd9659e1d8a2eb807399d982bc4c226",
      "continuation-context.schema.json": "0a950f2c212f0c0b3340cb83e250f24d9dde8893f6aa2e8895d9712739a5c83a",
      "agent-report.schema.json": "7a901c27e18e9992a4a69b0b1a4e9a73d20b6de4bd050ab9c43b176d32bd5599",
      "stop-response.schema.json": "99dabeac273a0be54a8dbb5ffdb764d156d1af4622f0dd9402feaa81bfc4f972"
    },
    "semanticValidatorSha256": "c858af0bdc6c017cbf3dcbccc1e32567b8500985c38aff27606d04d28a08c598",
    "digestDomains": [
      "io.hacp.task-packet.v0.3-candidate",
      "io.hacp.human-decision.v0.3-candidate",
      "io.hacp.consumption-receipt.v0.3-candidate",
      "io.hacp.continuation-context.v0.3-candidate",
      "io.hacp.agent-report.v0.3-candidate",
      "io.hacp.review-finding.v0.3-candidate",
      "io.hacp.stop-response.v0.3-candidate",
      "io.hacp.successor-start-evidence.v0.3-candidate"
    ]
  },
  "producer": {
    "implementationId": "wits.hacp-v03-candidate-interworking-proof.v0",
    "sourceRepository": "https://github.com/joefeser/what-is-the-spec",
    "sourceCommit": "48bac116b1077a81dc7adf8e34c78cc3da17c7b2",
    "generatedAt": "2026-09-08T03:01:42.030Z"
  },
  "fixtureInventory": [
    {
      "path": "records/success/task-packet.json",
      "schema": "task-packet.schema.json",
      "sha256": "cec64bab912f1881cf2b653843804c3f63ffcc6135217bad4aea0cfa9e2e7098"
    },
    {
      "path": "records/success/decision-request.json",
      "schema": "review-finding.schema.json",
      "sha256": "270f7ac26660c49c247e5d4af2c83e4c70ea3ae63816f9c75f43c605b1864b8e"
    },
    {
      "path": "records/success/authority-basis-decision.json",
      "schema": "human-decision.schema.json",
      "sha256": "d7237564d16245048287517673e87c929a88ddfcf56b2e3ce1831dd06fe5252d"
    },
    {
      "path": "records/success/consumption-receipt.json",
      "schema": "consumption-receipt.schema.json",
      "sha256": "f84749ac953164b5335add6add06211fc5613ac2355ba5acbb0393ba688fd10f"
    },
    {
      "path": "records/success/continuation-context.json",
      "schema": "continuation-context.schema.json",
      "sha256": "4380cff013702870c412df0e4184d025a3780541a3bd1715c814ed8b9ce7ffcf"
    },
    {
      "path": "records/success/agent-report.json",
      "schema": "agent-report.schema.json",
      "sha256": "b08c3377ddfbf4c2806ece51178b125b638c196e231940a9ec96f6bf5a123e31"
    },
    {
      "path": "records/stop/task-packet.json",
      "schema": "task-packet.schema.json",
      "sha256": "3dd8e92131daac2d043faf38881526ebf6c6d451b9a5ceaf23ceb0c2d849c874"
    },
    {
      "path": "records/stop/decision-request.json",
      "schema": "review-finding.schema.json",
      "sha256": "06836a60619cc9342208a87c6bb276e86f143f7ccd38b25f5261864be5865ebe"
    },
    {
      "path": "records/stop/authority-basis-decision.json",
      "schema": "human-decision.schema.json",
      "sha256": "b0b8b5bafb3119fd75d3fec978d2adf1ddb42008febd103e766c4c6620c5fa92"
    },
    {
      "path": "records/stop/stop-response.json",
      "schema": "stop-response.schema.json",
      "sha256": "ea4bbb58a989017d0d5a23a40ae35d25f3780c0b39c24f86cace6188b3949e7d"
    },
    {
      "path": "records/stop/response-decision.json",
      "schema": "human-decision.schema.json",
      "sha256": "2493bf81d9166e931e5849726e4514c1307c638c73a7e54eebc773dc75e5571e"
    }
  ],
  "bundles": [
    {
      "id": "successful_continuation",
      "kind": "successful_continuation",
      "records": [
        {
          "role": "task_packet",
          "path": "records/success/task-packet.json"
        },
        {
          "role": "decision_request",
          "path": "records/success/decision-request.json"
        },
        {
          "role": "authority_basis_decision",
          "path": "records/success/authority-basis-decision.json"
        },
        {
          "role": "consumption_receipt",
          "path": "records/success/consumption-receipt.json"
        },
        {
          "role": "continuation_context",
          "path": "records/success/continuation-context.json"
        },
        {
          "role": "agent_report",
          "path": "records/success/agent-report.json"
        }
      ]
    },
    {
      "id": "pre_start_stop",
      "kind": "pre_start_stop",
      "records": [
        {
          "role": "task_packet",
          "path": "records/stop/task-packet.json"
        },
        {
          "role": "decision_request",
          "path": "records/stop/decision-request.json"
        },
        {
          "role": "authority_basis_decision",
          "path": "records/stop/authority-basis-decision.json"
        },
        {
          "role": "stop_response",
          "path": "records/stop/stop-response.json"
        }
      ]
    },
    {
      "id": "stop_decision_response",
      "kind": "stop_decision_response",
      "records": [
        {
          "role": "task_packet",
          "path": "records/stop/task-packet.json"
        },
        {
          "role": "decision_request",
          "path": "records/stop/decision-request.json"
        },
        {
          "role": "authority_basis_decision",
          "path": "records/stop/authority-basis-decision.json"
        },
        {
          "role": "stop_response",
          "path": "records/stop/stop-response.json"
        },
        {
          "role": "response_decision",
          "path": "records/stop/response-decision.json"
        }
      ]
    }
  ]
}
